{
  "集": 1,
  "参数": {
    "fps": 12,
    "阈值": 0.6
  },
  "句": [
    {
      "句": "E01-S001",
      "起": "00:05.0",
      "止": "00:07.0",
      "文本": "今天必须说清楚。",
      "声线": "E01-V1",
      "镜头": [
        "E01-K002"
      ],
      "结论": "画内",
      "复核": null,
      "轨迹": [
        {
          "id": "E01-K002-F1",
          "轨迹组": "G1",
          "框": {
            "x": 0.2,
            "y": 0.2,
            "width": 0.3,
            "height": 0.3
          },
          "说话分数": 0.84,
          "状态": "开口",
          "评分依据": {
            "有效帧": 12,
            "检测帧": 12,
            "静音基线帧": 5,
            "基线来源": "同轨迹无人声时段"
          },
          "不可用原因": [],
          "依据帧": [
            "素材/frames/K002_01.jpg"
          ],
          "曲线": [
            {
              "时间": "00:05.033",
              "张合比": 0.12,
              "有效": true,
              "音量": 0.04
            }
          ],
          "模型曲线": [
            {
              "时间": "00:05.040",
              "说话概率": 0.75
            }
          ]
        }
      ]
    }
  ],
  "声线配对": [
    {
      "声线": "E01-V1",
      "轨迹组": "G1",
      "支持句数": 1,
      "反例句数": 0
    }
  ]
}
